address,area,price,longtitude,latitude
"Москва, ул. Василия Ощепкова, 1с1",37.6,149176,55.554791,37.462694
"Москва, Ясеневая ул., 12к1",85.2,185446,55.601203,37.727553
"Москва, б-р Андрея Тарковского, 9",68.2,149560,55.625211,37.345491
"Москва, ул. Твардовского, 4к1",80.9,210136,55.797969,37.39099
"Москва, Большая Марьинская ул., 11",76.4,244764,55.806418,37.633976
"Москва, ул. Рябиновая, жилые дома",39.6,228899,54.709304,39.546669
"Москва, Новокуркинское ш., 23/15",42.0,209524,55.897841,37.398662
"Москва, Каширское ш., 65к2",37.3,217158,55.599728,37.724723
"Москва, Селигерская ул., 18к4",51.2,136719,55.866723,37.553927
"Москва, Московская область, город Люберцы, микрорайон Зенино ЖК Самолёт, улица Вертолетная, дом 24",35.0,122857,55.703008,37.966298
"Москва, пр-т Волгоградский, вл. 32/3, стр. 6",54.0,199074,55.72127,37.694253
"Москва, Родионовская ул., 10к1",102.0,192157,55.895525,37.390128
"Москва, Зеленоград, 2305А",42.0,169048,55.968025,37.187971
"Москва, пр-т Ленинградский, д. 29, корп. 1",45.7,290556,55.785169,37.564033
"Москва, ул. Сельскохозяйственная, вл. 35, стр. 5",82.0,181707,55.85718,37.627687
"Москва, Москва, улица Верхние Поля, 45к1",46.0,178261,55.667731,37.774014
"Москва, Красноказарменная ул., 14Ак2",33.8,260355,55.753225,37.706973
"Москва, Пресненская наб., 12",46.5,511828,55.749511,37.537083
"Москва, ул. Тайнинская, вл. 9",28.3,179634,55.882409,37.681748
"Москва, пр-т Волгоградский, вл. 32/3, стр. 6",80.0,197500,55.72127,37.694253
"Москва, пос. Московский, дер. Румянцево, д. 3, вл. 17Е",64.5,121501,55.633963,37.425468
"Москва, пр-т Волгоградский, вл. 32/5, корп. А, стр. 1",82.0,181300,55.733097,37.670357
"Москва, пр-т Волгоградский, вл. 32/5, корп. А, стр. 3",25.5,194000,55.732342,37.672181
"Москва, Москва, Ходынский б-р, 20А",46.6,285408,55.790777,37.523204
"Москва, Тайнинская ул., 9",49.8,161767,55.882409,37.681748
"Москва, ул. Донецкая, вл. 30, стр. 2",54.0,159259,55.646223,37.705832
"Москва, ул. Тайнинская, вл. 9",62.1,166618,55.882409,37.681748
"Москва, пр-т Мира, д. 188Б, корп. 3",109.9,169950,55.835483,37.658338
"Москва, Ягодная ул., 8к1",68.0,147044,55.576793,37.673403
"Москва, ул. Ходынская, д. 2",45.0,331111,55.770806,37.564212
"Москва, 6-я Радиальная ул., 5к4",52.0,173077,55.603446,37.662506
"Москва, б-р Андрея Тарковского, 4",64.8,162037,55.62849,37.341287
"Москва, ул. Бажова, 8",53.0,271698,55.831999,37.661096
"Москва, Дмитровское ш., вл. 107, стр. 1Б",58.6,194710,55.881192,37.538736
"Москва, пр-д Багратионовский, стр. 3",51.0,260000,55.744992,37.510152
"Москва, ул. Наметкина, д. 18",146.0,249682,55.659571,37.560071
"Москва, Авиационная ул., 77",132.8,274849,55.807982,37.450845
"Москва, ул. Петра Алексеева, вл. 12, блок-секция 4",132.5,200830,55.717006,37.428791
"Москва, ул. Восточная, вл. 4А/1, корп. 4, 5",70.7,257114,55.715074,37.660889
"Москва, ул. Петра Алексеева, вл. 12",59.0,194039,55.717006,37.428791
"Москва, Южный административный округ, район Нагатинский Затон",30.0,169433,55.682849,37.681568
"Москва, ул. Донецкая, вл. 30, стр. 3",93.6,118326,55.64285,37.703649
"Москва, Карамышевская наб., 36",43.5,301149,55.769094,37.470851
"Москва, д. Марусино, Заречная ул., 34к7",33.2,96386,55.692364,37.964987
"Москва, Россия, Москва г, Изюмская ул, д. 26, корп. 2",61.1,160393,55.55057,37.560996
"Москва, Россия, Москва г, Щелковское ш, д. 79",53.0,232075,55.813885,37.807925
"Москва, Россия, Москва г, Удальцова ул, д. 69",80.0,328750,55.679225,37.499067
"Москва, ул. Производственная, вл. 6, стр. 4",39.4,182487,55.645126,37.390712
"Москва, Зеленоград, 2303",44.3,162528,55.966912,37.187046
"Москва, Совхозная ул., 37",81.0,158012,55.673849,37.759237
"Москва, Люберцы, Вертолётная ул., 4/2",29.0,144828,55.706543,37.958537
"Москва, Россия, Москва г, Мастеркова ул, д. 1",107.1,314192,55.710093,37.658877
"Москва, Россия, Москва г, Бескудниковский б-р, д. 6, стр. 3",50.1,197605,55.858923,37.563063
"Москва, Россия, Москва г, Новорогожская ул, д. 30",76.0,246053,55.739189,37.68906
"Москва, Островной пр., 1",164.0,359756,55.757805,37.447548
"Москва, Москва, Староалексеевская улица, вл24",36.0,224688,55.80996,37.644243
"Москва, Зеленодольская ул., 36к2",114.0,263158,55.709292,37.764734
"Москва, Москва, Пятницкое Шоссе, Муравская улица, д 38 к2",52.0,167308,55.862681,37.37244
"Москва, Энтузиастов ш, 1 корпус 1",73.0,228767,55.748022,37.687111
"Москва, Псковская ул., 9к2",41.2,162621,55.906456,37.55019
"Москва, ул. Бочкова, вл. 11А, корп. 1",43.9,219200,55.810405,37.62634
"Москва, Ленинский пр-т, 105к3",119.0,256303,55.664284,37.517464
"Москва, ул. Поляны, 5",85.0,163529,55.557765,37.555023
"Москва, Ленинский пр-т, 139",115.0,291304,55.641122,37.470635
"Москва, Лазоревый пр., 1Ак3",130.0,346154,55.847295,37.637569
"Москва, Нахимовский пр-т, 73",148.0,195946,55.682453,37.552373
"Москва, Веерная ул., 22к3",112.7,244011,55.709302,37.483373
"Москва, г Москва, ул Производственная, д 2",43.3,211316,55.650455,37.388008
"Москва, Хорошёвское ш., 12к1",64.5,341085,55.774745,37.548609
"Москва, город Москва, Филевский парк район, проезд Береговой, дом 5, корпус 2",62.0,217742,55.756376,37.508975
"Москва, пос. Московский, дер. Румянцево, д. 2, вл. 17Е",37.0,156873,55.633963,37.425468
"Москва, ул. Зорге, вл. 9, корп. 1",64.7,164587,55.781818,37.506639
"Москва, г Москва, ул Радиальная 6-я, д 3 к 9",65.0,169231,55.604748,37.664024
"Москва, г Москва, ул Старокачаловская, д 10",128.5,185992,55.569596,37.589796
"Москва, ул. Авиаконструктора Сухого, д. 2, корп. 1, 2",82.2,321735,55.786313,37.542428
"Москва, ул. Профсоюзная, д. 128А",61.5,255000,55.630146,37.514572
"Москва, Пресненская наб., 12",143.0,531469,55.749511,37.537083
"Москва, Пресненская наб., 8с1",224.0,383929,55.747115,37.539078
"Москва, 1-й Красногвардейский пр., 21с2",93.0,752688,55.74938,37.534092
"Москва, Пресненская наб., 6с2",220.1,345298,55.748143,37.540488
"Москва, Люберцы, ул. Барыкина, 2",39.5,111367,55.706761,37.956049
"Москва, Южный административный округ, район Нагатинский Затон",30.0,169455,55.682849,37.681568
"Москва, Павелецкая наб., стр. 3.1",79.6,234717,55.716022,37.64648
"Москва, ул. Мантулинская, вл. 7",80.5,369000,55.755464,37.547342
"Москва, д. Рузино, микрорайон Кутузовский, 2",52.0,92308,55.950685,37.17941
"Москва, Павелецкая наб., стр. 3.3",85.3,249745,55.716022,37.64648
"Москва, Истринская ул., 8к3",85.0,234118,55.735657,37.432537
"Москва, ул. Маресьева, стр. 8",75.3,129031,55.711828,37.939412
"Москва, ул. Петра Алексеева, вл. 12",37.7,236649,55.717006,37.428791
"Москва, ул. 6-я Радиальная, д. 3, корп. 2",66.2,151057,55.606416,37.665686
"Москва, пр-т Ленинградский, д. 29, корп. 3",73.7,271987,55.784303,37.562775
"Москва, Самотёчная ул., 5",202.0,336634,55.775236,37.618372
"Москва, ул. Дмитрия Ульянова, 31",177.7,388295,55.684726,37.58544
"Москва, пр-т Волгоградский, вл. 32/3, стр. 6",79.2,188573,55.72127,37.694253
"Москва, Россия, Москва, Профсоюзная улица, 104",135.0,240000,55.64192,37.523456
"Москва, Россия, Москва, Береговой проезд, 5к1",45.3,267108,55.7559,37.506675
"Москва, Новочерёмушкинская ул., 58",111.0,175181,55.668224,37.563054
"Москва, ул. Маресьева, стр. 7",51.0,147486,55.707978,37.930429
"Москва, Россия, Москва г, Невельского Проезд, д. 3, корп. 1",46.9,264392,55.750803,37.698609
"Москва, Россия, Москва г, Федора Полетаева ул, д. 4, корп. 1",79.1,173198,55.714835,37.775272
"Москва, пр-д Шмитовский, вл. 39",41.2,227889,55.755135,37.526986
"Москва, пер. 1-ый Пехотный, вл. 2, стр. 2",67.6,260807,55.805923,37.483077
"Москва, ул. Бочкова, вл. 11А, корп. 2",74.3,269891,55.810405,37.62634
"Москва, пр-т Рязанский, вл. 2",43.0,218605,55.729417,37.743148
"Москва, дер. Раздоры, ш. Мякининское, стр. 11",55.5,99939,55.797609,37.353477
"Москва, ул. Бориса Пастернака, 3",63.0,190476,55.644074,37.326725
"Москва, пер. 1-ый Пехотный, вл. 2, стр. 2",61.8,285815,55.805923,37.483077
"Москва, Русаковская ул., 1",37.5,344000,55.78197,37.670115
"Москва, 1-я Тверская-Ямская ул., 2",108.0,819444,55.77079,37.595492
"Москва, ш. Варшавское, вл. 170Е, корп. 1",61.9,197900,55.582925,37.580032
"Москва, Москва, Большая Татарская улица, 7, подъезд 1",219.3,911993,55.74221,37.633643
"Москва, Москва, Большая Татарская улица, 7, подъезд 3",288.8,841413,55.742286,37.634883
"Москва, Волоколамское ш., д. 71, корп. 2",74.0,202703,55.821077,37.430462
"Москва, 6-я Радиальная ул., 3к6",64.3,155521,55.605866,37.664743
"Москва, Муравская ул., 38к2",12.3,191057,55.862681,37.37244
"Москва, Мосфильмовская ул., 8",114.0,427508,55.723257,37.52766
"Москва, Москва, Ландышевая ул, 12",88.5,265537,55.884706,37.390909
"Москва, пр-т Академика Сахарова/ул. Садово-Спасская, МФК «RED7» (РЕД7)",51.7,385147,55.769352,37.641593
"Москва, Минская ул., 1Б",126.5,553360,55.71697,37.500818
"Москва, ул. Удальцова, 17к1",78.0,373077,55.673128,37.513098
"Москва, пр-д Шмитовский, вл. 39",40.6,238234,55.755135,37.526986
"Москва, Рязанский пр-т, стр. 12",45.8,207424,55.725255,37.761168
"Москва, п. Московский, д. Говорово, ул. Татьянин парк, стр. 8Б",82.1,163216,55.657057,37.423482
"Москва, пос. Московский, дер. Румянцево, д. 3, вл. 17Е",85.0,113380,55.633963,37.425468
"Москва, Зеленоград, Георгиевский пр-т, 37к1",19.5,187179,55.968,37.150583
"Москва, Можайское ш., 45к1",72.0,190278,55.715936,37.407133
"Москва, Россия, Москва, Москва, Академика Янгеля ул, 2",96.0,187500,55.596457,37.599822
"Москва, ул. Новоалексеевская, ЖК «Серебряный Фонтан»",45.2,244912,55.807886,37.647846
"Москва, Москва г, Мишина ул, 14",49.0,322310,55.794426,37.566225
"Москва, Москва г, Рублевское ш, 70К5",50.0,205000,55.770659,37.375234
"Москва, пр-д 3-й Автозаводский, вл. 13",236.4,305935,55.707522,37.655912
"Москва, Москва, проспект Мира, 188Бк1",97.0,176289,55.834472,37.65805
"Москва, ул. Маресьева, стр. 8",36.9,162867,55.711828,37.939412
"Москва, Минская ул., 2",111.0,360360,55.716037,37.503998
"Москва, б-р Генерала Карбышева, 14",72.1,263523,55.780213,37.471623
"Москва, Филёвский б-р, 24к1",94.6,375264,55.766977,37.485646
"Москва, Москва,Шмитовский, д. 39к 3",44.2,285068,55.752936,37.524345
"Москва, Новозаводская ул., 8",120.0,300000,55.751771,37.50822
"Москва, Муравская ул., 42к3",84.2,136580,55.858963,37.37297
"Москва, Ключевая ул., 20",38.0,207868,55.633536,37.760845
"Москва, Жигулёвская ул., 6к2",58.2,214777,55.711417,37.759668
"Москва, ул. Недорубова, 18к1",23.0,139130,55.70251,37.935522
"Москва, Мичуринский пр-т, 13",39.0,320513,55.698224,37.511257
"Москва, ул. Архитектора Щусева, 1",61.6,230519,55.699943,37.637183
"Москва, Россия, Москва, улица Большие Каменщики, 8",117.0,384615,55.735459,37.655787
"Москва, Россия, Москва, Мосфильмовская улица, 88к2с7",78.0,423077,55.705062,37.495518
"Москва, ул. Василисы Кожиной, вл. 13",48.6,181077,55.736184,37.499866
"Москва, Проспект Ленинский, 116 корпус 1",172.0,319767,55.667731,37.512119
"Москва, Россия, Москва, Мосфильмовская улица, 8",98.0,561224,55.723257,37.52766
"Москва, Митинская ул., 28к2",54.0,238889,55.845815,37.369053
"Москва, Россия, Москва, Динамо, Северный административный, Ленинградский проспект, 36с10",52.3,334608,55.788515,37.567482
"Москва, Ярцевская ул., 24к2",94.0,184043,55.739544,37.415047
"Москва, ш. Дмитровское, вл. 1",40.4,267574,55.920487,37.54135
"Москва, пр-д Багратионовский, стр. 3",45.7,317481,55.744992,37.510152
"Москва, пр-д 3-й Автозаводский, вл. 13",64.3,248077,55.707522,37.655912
"Москва, пос. Московский, дер. Румянцево, д. 3, вл. 17Е",25.2,163282,55.633963,37.425468
"Москва, кв. 75, ул. Народного Ополчения, вл. 15, стр. 6",57.6,230035,55.774335,37.474668
"Москва, с/п Булатниковское, дер. Дрожжино, стр. 23-25",36.3,134986,55.528034,37.595815
"Москва, Москва, Первомайская ул, 42к3",90.0,294444,55.792503,37.787776
"Москва, Шелепихинская наб., д. 34, корп. 1",100.0,459000,55.76132,37.512505
"Москва, Мичуринский пр-т, 56",83.3,261705,55.69624,37.488035
"Москва, Москва, Шмитовский проезд, 16с1",80.0,487500,55.758443,37.549238
"Москва, ул. Маршала Бирюзова, 32к1",90.0,333333,55.798905,37.484244
"Москва, Ярцевская ул., 34к2",44.2,312217,55.741673,37.419422
"Москва, Улица Минская, корпус Б",100.0,525769,55.716037,37.503998
"Москва, Улица Минская, корпус А",201.7,433937,55.716037,37.503998
"Москва, Улица Минская, 2В корпус 3",176.0,621891,55.716504,37.506316
"Москва, Улица Минская, корпус А1",201.6,444891,55.718872,37.499893
"Москва, ул. Донецкая, д. 30, корп. 1",38.3,203655,55.645476,37.707215
"Москва, Россия, Москва, Октябрьское поле, Северо-Западный административный, улица Маршала Тухачевского, 49",88.0,284091,55.785037,37.464221
"Москва, 1-й Нагатинский пр., 11к3",86.0,215116,55.676585,37.634092
"Москва, Россия, Москва, Мосфильмовская улица, 8",107.0,532710,55.723257,37.52766
"Москва, Россия, Москва, Басманный переулок, 5",46.0,326087,55.771206,37.658212
"Москва, п. Внуковское, дер. Рассказовка, уч. 13/2, стр. 1",58.9,146391,55.631015,37.327866
"Москва, п. Внуковское, дер. Рассказовка, уч. 13/2, стр. 8",42.0,160908,55.631015,37.327866
"Москва, Россия, Москва, 2-я Брестская улица, 6",86.0,352035,55.770811,37.591189
"Москва, Россия, Москва, проспект Маршала Жукова, 43к5",77.0,389610,55.773829,37.472027
"Москва, Москва, Садовническая набережная, 7",147.3,431005,55.746547,37.628038
"Москва, ул. Вавилова, д. 69А",119.6,284227,55.681047,37.551088
"Москва, Садовническая наб., вл. 3-7",160.6,431005,55.747211,37.627301
"Москва, Москва, Красногвардейский бульвар, 15с2",62.9,322493,55.762713,37.542913
"Москва, ул. Усачева, вл. 11, стр. 2.9",98.6,496142,55.726583,37.572648
"Москва, ул. Усачева, ЖК «Садовые Кварталы»",77.7,542010,55.726462,37.572459
"Москва, ул. Мневники, вл. 5",76.5,211300,55.772482,37.49683
"Москва, ул. Усачева, вл. 11, стр. 5.2",60.9,886082,55.726583,37.572648
"Москва, Ходынский б-р, 2",33.0,303030,55.789391,37.536823
"Москва, 1-я ул. Леонова, 16",70.2,242959,55.844354,37.642581
"Москва, ул. Новочерёмушкинская, вл. 17",93.5,450048,55.683919,37.582745
"Москва, ул. 3-я Ямского Поля, д. 9",145.9,410000,55.781626,37.580894
"Москва, ул. Красных зорь, вл. 33А",97.5,217486,55.723121,37.432403
"Москва, Москва, Вешняковская улица, 10с2",47.8,199243,55.73553,37.826296
"Москва, ул. Новодмитровская, д. 2, корп. 7",67.0,205687,55.802462,37.591934
"Москва, Москва, улица Вавилова, 69А",75.8,306244,55.681047,37.551088
"Москва, пос. Московский, дер. Румянцево, д. 3, вл. 17Е",34.8,150928,55.633963,37.425468
"Москва, ул. Дыбенко, вл. 7/1, стр. 3",59.4,234942,55.877996,37.4796
"Москва, пос. Московский, дер. Румянцево, д. 1, вл. 17Е",76.3,132423,55.633963,37.425468
"Москва, Москва, Профсоюзная улица, 128к3",56.2,194000,55.630609,37.514715
"Москва, Москва, улица Вавилова, 69А",168.1,360079,55.681047,37.551088
"Москва, пр. Невельского, 6к2",50.2,249004,55.752379,37.700137
"Москва, Москва г, Лазоревый проезд, 5К1",56.0,284821,55.847861,37.635206
"Москва, пр. Черского, 13",64.0,193438,55.876551,37.577741
"Москва, пр-д Шмитовский, вл. 39",100.0,253949,55.755135,37.526986
"Москва, Москва г, Невельского проезд, 3К2",98.0,204082,55.751979,37.697846
"Москва, Россия, Москва, проспект Мира, 188Бк4",143.0,145608,55.834568,37.659622
"Москва, Россия, Москва, 3-й Самотёчный переулок, 13",55.8,421147,55.778932,37.613593
"Москва, пр-д Шмитовский, вл. 39, корп. 2",66.0,295455,55.754618,37.524058
"Москва, ул. Удальцова, 50",131.0,328244,55.685117,37.490775
"Москва, Смольная ул., 61к1",58.0,210345,55.868607,37.472171
"Москва, ул. Бочкова, вл. 11А, корп. 3",94.1,188060,55.810405,37.62634
"Москва, пер. 1-ый Пехотный, вл. 2, стр. 2",62.9,260041,55.805923,37.483077
"Москва, Россия, Москва г., Невельского проезд, 6к3",46.0,221739,55.751898,37.702077
"Москва, Россия, Москва г., улица Мосфильмовская, 74Б",78.0,307692,55.711108,37.504708
"Москва, пр-т Мичуринский, стр. 3",108.4,304428,55.704509,37.512838
"Москва, 6-я Радиальная ул., 5к2",115.0,160870,55.604605,37.658751
"Москва, Россия, Москва, улица Бутлерова, 7Б",39.0,192308,55.653726,37.529834
"Москва, ул. Улофа Пальме, 1",62.0,387097,55.717847,37.512191
"Москва, город Москва, Алексеевский район, улица Маломосковская, дом 14, строение 14",68.7,247453,55.812752,37.647549
"Москва, пр-д 3-й Автозаводский, вл. 13",126.6,254040,55.707522,37.655912
"Москва, Россия, Москва, улица Академика Пилюгина, 4",98.0,241827,55.672691,37.542222
"Москва, Москва, Маломосковская ул, 14",70.6,254816,55.812752,37.647549
"Москва, Россия, Москва, Каширское шоссе, 65к2",37.2,217742,55.599728,37.724723
"Москва, ул. Кутузова, 11к4",60.0,275000,55.722553,37.411616
"Москва, Большая Филёвская ул., 4",65.0,338462,55.753686,37.513143
"Москва, ул. Молодцова, 29к2",41.5,240964,55.878682,37.624723
"Москва, Западный административный округ, район Филёвский Парк",43.0,267442,55.749805,37.494584
"Москва, Амурская ул., 3Д",68.3,154158,55.809186,37.759246
"Москва, ул. Амурская, вл. 3",58.9,146350,55.808478,37.758797
"Москва, ул. Красных зорь, вл. 33А",43.1,200500,55.723121,37.432403
"Москва, Ильменский пр., вл. 14, стр. Д",61.3,214140,55.861524,37.5425
"Москва, Дмитровское ш., 71к3",22.3,211973,55.855361,37.559388
"Москва, пос. Московский, дер. Румянцево, д. 2, вл. 17Е",104.0,121311,55.633963,37.425468
"Москва, пос. Московский, дер. Румянцево, д. 3, вл. 17Е",52.5,127615,55.633963,37.425468
"Москва, пер. 1-ый Пехотный, вл. 2, стр. 2",38.8,286000,55.805923,37.483077
"Москва, Москва, Москва, Новослободская, ул. Селезнёвская, дом 22",215.8,393883,55.780426,37.607466
"Москва, Москва, Вешняковская ул, 10",36.7,201635,55.735378,37.826494
"Москва, Москва, Смольная ул, 44к1",56.7,170899,55.869117,37.473959
"Москва, ш. Варшавское, вл. 170Е, корп. 4",47.0,202128,55.583011,37.583122
"Москва, город Москва, Раменки район, улица Столетова, дом 15",106.0,297170,55.702693,37.499013
"Москва, город Москва, Алексеевский район, улица Маломосковская, дом 14, строение 14",45.2,282965,55.812752,37.647549
"Москва, Восточный административный округ, район Соколиная Гора",98.1,187564,55.772775,37.730625
"Москва, ул. Бочкова, вл. 11А, корп. 3",106.0,177933,55.810405,37.62634
"Москва, Россия, Москва, улица Народного Ополчения, 33",67.0,277612,55.785367,37.479825
"Москва, Россия, Москва, Рублёвское шоссе, 101",50.0,390000,55.743512,37.422099
"Москва, пр-д Шмитовский, вл. 39",71.0,257746,55.755135,37.526986
"Москва, Россия, Москва, Давыдковская улица, 3",212.0,376415,55.72746,37.479977
"Москва, Россия, Москва, Ленинградский проспект, 36с38",75.0,318667,55.789466,37.567186
"Москва, ул. Амурская, вл. 3",39.0,184615,55.808478,37.758797
"Москва, Россия, Москва, Авиационная улица, 77к2",205.0,302439,55.809348,37.450863
"Москва, Россия, Москва, Сосновая аллея, 1",127.0,307087,55.82002,37.462954
"Москва, пр-т Мичуринский, стр. 3",78.0,333333,55.704509,37.512838
"Москва, Россия, Москва, Нежинская улица, 8к1",126.0,214286,55.709196,37.469997
"Москва, Выборгская ул., 7к1",55.0,189091,55.835503,37.495725
"Москва, Молодогвардейская ул., 15",126.6,260664,55.733442,37.427094
"Москва, г Москва, ул Филевская 2-я, д 6",70.0,249286,55.736265,37.493632
"Москва, Волоколамское ш., д. 71, корп. 1",72.7,213205,55.822412,37.432043
"Москва, Смольная ул., 44к2",27.2,268382,55.869511,37.473554
