address,area,price,longtitude,latitude
"Москва, ул. Сущёвский Вал, 55",155.0,286000,55.793698,37.61441
"Москва, пос. Московский, дер. Румянцево, д. 2, вл. 17Е",75.4,116428,55.633963,37.425468
"Москва, Ленинский пр-т, 95Б",106.1,282752,55.672905,37.524318
"Москва, Конаковский пр.",82.0,206024,55.845911,37.482151
"Москва, пр-т Ленинградский, ЖК «Царская площадь»",94.5,275132,55.784779,37.562703
"Москва, пр-т Вернадского, 60к1",136.0,204507,55.67423,37.495635
"Москва, Ордынский туп., д. 4А",151.2,1164749,55.741227,37.62325
"Москва, Россия, Москва, Москва, Смоленская пл, 7-9, Арбат",117.0,1110256,55.751467,37.598079
"Москва, пр-д 3-й Автозаводский, вл. 13",62.6,241807,55.707522,37.655912
"Москва, Москва, Кронштадтский бульвар, 6к4",64.0,249219,55.84073,37.494404
"Москва, пос. Московский, дер. Румянцево, д. 3, вл. 17Е",57.0,129567,55.633963,37.425468
"Москва, п. Филимонковское, дер. Староселье, стр. 4",30.2,136941,55.553809,37.313484
"Москва, ул. Производственная, вл. 6, стр. 8",39.4,189604,55.644821,37.391215
"Москва, п. Филимонковское, дер. Староселье, стр. 2",77.4,111150,55.554058,37.313699
"Москва, ул. Автозаводская, стр. 16",71.0,229634,55.704215,37.645196
"Москва, ул. Автозаводская/Архитектора Щусева/наб. Марка Шагала, ЖК «ЗИЛАРТ»",79.5,210516,55.69346,37.630598
"Москва, Ильменский пр., вл. 14, стр. Д",25.5,226275,55.861524,37.5425
"Москва, Ленинский пр-т, 111А",102.0,333333,55.661902,37.508292
"Москва, Москва, Донецкая улица, 30к2",56.3,154529,55.646223,37.705832
"Москва, Мукомольный пр., 2",54.0,275926,55.75133,37.526887
"Москва, Россия, Москва г, Ярцевская ул, д. 34, корп. 2",46.0,300000,55.741673,37.419422
"Москва, Россия, Москва г, Ярцевская Улица, д. 34, корп. 1",66.4,289157,55.742276,37.419027
"Москва, Ленинградское ш, д.25к2",94.0,218085,55.827671,37.487559
"Москва, ул. Поляны/Скобелевская, стр. 1",42.0,169048,55.551385,37.555589
"Москва, ул. Бочкова, вл. 11А, корп. 3",57.0,190933,55.810405,37.62634
"Москва, ул. Бочкова, вл. 11А, корп. 1",29.6,246583,55.810405,37.62634
"Москва, Россия, Московская область, Москва, Большой толмачевский 4с1",171.0,877135,55.740725,37.622881
"Москва, пр. Невельского, 6к3",95.4,262055,55.751898,37.702077
"Москва, Производственная ул., 6к9",53.5,160560,55.647254,37.386418
"Москва, ул. Никитина/Бианки, стр. 8",38.8,130799,55.605861,37.361005
"Москва, ул. Паршина, вл. 10",79.1,224836,55.78975,37.456468
"Москва, ул. Нижняя Красносельская, д. 35, стр. 23",75.4,270196,55.77517,37.674022
"Москва, Россия, Москва, Дмитровская, Новодмитровская улица, 2к5",67.0,238806,55.80357,37.591027
"Москва, Россия, Москва, Ходынский бульвар, 15",140.0,400000,55.786708,37.523249
"Москва, Врачебный пр., 11к3",30.2,248344,55.812944,37.452462
"Москва, Мосфильмовская ул., 88к14",48.6,344444,55.705671,37.491134
"Москва, Москва, Московский, Татьянин Парк ул., 14к2, Татьянин парк",74.0,200946,55.655026,37.424399
"Москва, пр-д 3-й Автозаводский, вл. 13",62.6,241807,55.707522,37.655912
"Москва, пос. Московский, дер. Румянцево, д. 3, вл. 17Е",57.0,129567,55.633963,37.425468
"Москва, пос. Московский, дер. Румянцево, д. 2, вл. 17Е",99.2,121326,55.633963,37.425468
"Москва, ул. Бочкова, вл. 11А, корп. 3",57.0,190933,55.810405,37.62634
"Москва, ш. Ленинградское, вл. 58",34.7,230100,55.839522,37.482879
"Москва, ул. Академика Янгеля, 2",64.9,215716,55.596457,37.599822
"Москва, Москва, Муравская ул, 42к3",80.6,175682,55.858963,37.37297
"Москва, Москва, Пятницкое ш, 15",107.0,154206,55.842565,37.379186
"Москва, Россия, Москва, улица Народного Ополчения, 11",67.0,380597,55.772416,37.4743
"Москва, Москва, Ломоносовский пр-кт, 25к5",100.0,477500,55.692008,37.530939
"Москва, км Киевское шоссе 23-й (п Московский), 11 корп. 2",70.0,178571,55.617297,37.411454
"Москва, Россия, Москва, Минская улица, 1Гк2",121.0,316529,55.712122,37.499067
"Москва, Москва, Новокуркинское ш, 51",132.0,166667,55.909534,37.388502
"Москва, Москва, Красногвардейская 3-я ул, 3",78.3,381865,55.756401,37.537065
"Москва, г Москва, б-р Славянский, д 9 к 6",55.1,266788,55.724753,37.467302
"Москва, ул. Краснобогатырская, вл. 38",84.5,181400,55.810364,37.702535
"Москва, Дмитровское ш., 29к1",33.0,209091,55.828051,37.571965
"Москва, Мукомольный пр., 2",87.0,264368,55.75133,37.526887
"Москва, пр-д Шмитовский, вл. 39",40.4,245121,55.755135,37.526986
"Москва, 6-я Радиальная ул., вл7к3",84.5,128994,55.606731,37.663081
"Москва, Россия, Москва г., улица Южнобутовская, 113",145.0,155103,55.533674,37.517725
"Москва, Россия, Москва г., проезд Попов, 4",103.3,274500,55.785073,37.69737
"Москва, Россия, Москва г., улица Медиков, 14 к2",85.0,217647,55.632093,37.675541
"Москва, рабочий пос. Дрожжино, Южная ул., 9",72.5,55172,55.521109,37.584694
"Москва, ул. Демьяна Бедного, д. 15",59.4,246000,55.776912,37.487389
"Москва, пр-т Маршала Жукова, 76к2",75.3,264940,55.78116,37.451061
"Москва, ул. Бутлерова, д. 7Б",51.6,169574,55.653726,37.529834
"Москва, ул. Выборгская, вл. 9",40.7,190418,55.836438,37.499381
"Москва, ул. Тайнинская, вл. 9",40.2,178738,55.882409,37.681748
"Москва, пос. Московский, дер. Румянцево, д. 1, вл. 17Е",73.8,131438,55.633963,37.425468
"Москва, ул. Выборгская/Адмирала Макарова, ЖК «Невский»",44.5,164045,55.835518,37.49577
"Москва, ул. Новослободская, стр. 1",111.3,435490,55.779155,37.600594
"Москва, ул. Берзарина, вл. 30",55.9,194704,55.790712,37.474444
"Москва, ул. Серпуховский Вал, д. 21, корп. 3",82.0,352439,55.710038,37.60894
"Москва, Москва, район Левобережный, Ленинградское шоссе, 17",70.6,244136,55.821178,37.495312
"Москва, Москва, район Левобережный, Ленинградское шоссе, 18",119.9,236347,55.824314,37.4963
"Москва, Москва, район Левобережный, Ленинградское шоссе, 28",34.9,236160,55.828541,37.491341
"Москва, Смольная ул., 49",82.1,225932,55.863545,37.478459
"Москва, Озёрная ул., 9",161.0,204969,55.682351,37.461301
"Москва, ул. Бочкова, вл. 11А, корп. 1",29.6,246583,55.810405,37.62634
"Москва, ул. Бочкова, вл. 11А, корп. 3",61.4,192125,55.810405,37.62634
"Москва, пос. Московский, дер. Румянцево, д. 3, вл. 17Е",34.9,155926,55.633963,37.425468
"Москва, пос. Московский, дер. Румянцево, д. 2, вл. 17Е",76.5,117422,55.633963,37.425468
"Москва, Ходынский б-р, 20А",33.0,296939,55.790777,37.523204
"Москва, ул. Автозаводская, стр. 16",55.2,225362,55.704215,37.645196
"Москва, ул. 3-я Хорошёвская, вл. 7",80.5,184994,55.787442,37.498168
"Москва, ул. Тайнинская, вл. 9",83.1,146729,55.882409,37.681748
"Москва, ул. Арбат, д. 24",129.5,790000,55.750069,37.592285
"Москва, ул. Усачева, вл. 11, стр. 2.10",96.1,594839,55.726583,37.572648
"Москва, ул. Усачева, жилые дома",138.5,641690,54.709304,39.546669
"Москва, ул. Усачева, вл. 11, стр. 2.7",159.5,699680,55.726583,37.572648
"Москва, ул. 3-я Хорошёвская, д. 19А",43.3,207991,55.784719,37.496677
"Москва, пос. Московский, дер. Румянцево, д. 1, вл. 17Е",40.5,168798,55.633963,37.425468
"Москва, Шелепихинская наб., д. 34, корп. 2",70.3,279287,55.762789,37.508984
"Москва, Огородный пр-д, вл. 20",93.2,176800,55.821871,37.593659
"Москва, ул. Никитина/Бианки, стр. 6",60.3,128240,55.605332,37.359423
"Москва, Москва, Веерная ул., д.2",48.2,267635,55.712888,37.489446
"Москва, ул. Берзарина, вл. 30",35.8,231671,55.790712,37.474444
"Москва, Ярцевская ул., 31",64.0,273438,55.743461,37.418425
"Москва, пр-д Шмитовский, вл. 39",76.6,203867,55.755135,37.526986
"Москва, пр-т Волгоградский, вл. 32/5, корп. А, стр. 4",60.3,180900,55.730725,37.670034
"Москва, пр-т Волгоградский, вл. 32/5, корп. А, стр. 1",40.6,195900,55.733097,37.670357
"Москва, Москва, Калужско-Рижская линия, метро Ботанический сад",89.3,237992,55.845228,37.637919
"Москва, Ломоносовский пр-т, 25к5",182.0,549451,55.692008,37.530939
"Москва, ул. Академика Королёва, 10",128.0,523438,55.823393,37.619899
"Москва, пр-т Ленинградский, вл. 31",70.6,293201,55.784977,37.56194
"Москва, 6-я Радиальная ул., 3к9",65.7,136986,55.604748,37.664024
"Москва, ул. Нижняя Красносельская, д. 35, стр. 23",75.4,270196,55.77517,37.674022
"Москва, пос. Московский, дер. Румянцево, д. 2, вл. 17Е",101.4,121319,55.633963,37.425468
"Москва, пос. Московский, дер. Румянцево, д. 3, вл. 17Е",60.5,121534,55.633963,37.425468
"Москва, ул. Бочкова, вл. 11А, корп. 3",126.6,184058,55.810405,37.62634
"Москва, ул. Тайнинская, вл. 9",56.4,145731,55.882409,37.681748
"Москва, Северо-Восточный административный округ, Останкинский район",50.8,172609,55.863894,37.620923
"Москва, ул. Погодинская, д. 4",187.1,1100544,55.734973,37.571013
"Москва, ул. Сущёвский Вал, вл. 49",76.1,391984,55.793915,37.612317
"Москва, ул. Петра Алексеева, вл. 12",74.7,196971,55.717006,37.428791
"Москва, ул. Восточная, вл. 4А/1, корп. 1, 2, 3",92.8,229950,55.715642,37.660763
"Москва, ул. Лобачевского/платформа «Матвеевская», стр. 1",97.6,216310,55.664274,37.506684
"Москва, Каширское ш., 65к2",20.0,197500,55.599728,37.724723
"Москва, Автозаводская ул., 23Бк2",47.0,212766,55.701262,37.651583
"Москва, Россия, Москва, Хорошёвское шоссе, 12к1",55.4,256318,55.774745,37.548609
"Москва, Россия, Москва, улица Искры, 1",110.0,163636,55.861545,37.671274
"Москва, ул. Никитинская, вл. 10/1",57.6,184557,55.799588,37.776296
"Москва, ш. Варшавское, вл. 170Е, корп. 4",23.0,239130,55.583011,37.583122
"Москва, пр-д 1-й Грайвороновский, вл. 1",49.0,187000,55.718922,37.727014
"Москва, ул. Автозаводская, стр. 8",130.7,175976,55.708486,37.659622
"Москва, Россия, Москва, улица Удальцова, 15",80.0,361250,55.672636,37.514724
"Москва, Россия, Москва, Фестивальная улица, 47",130.2,222734,55.85868,37.486032
"Москва, Россия, Москва, Туристская улица, 25к5",39.1,219949,55.854628,37.41529
"Москва, Россия, Москва, улица Академика Янгеля, 2",65.1,245776,55.596457,37.599822
"Москва, Россия, Москва, Шлюзовая набережная, 2А",45.0,540000,55.730948,37.64401
"Москва, Россия, Москва, улица Маршала Тухачевского, 51",67.0,291045,55.784516,37.460529
"Москва, Россия, Москва, улица Расплетина, 21",110.0,315455,55.798257,37.48199
"Москва, Россия, Москва, Нижняя Красносельская улица, 35с50",52.0,336519,55.774684,37.674067
"Москва, Россия, Москва, Муравская улица, 42к3",70.3,142248,55.858963,37.37297
"Москва, Россия, Москва, Михневская улица, 8",68.1,168869,55.579688,37.671085
"Москва, Россия, Москва, улица Генерала Белобородова, 27",130.1,222905,55.833491,37.357824
"Москва, ул. Производственная, вл. 6, стр. 3",33.6,203869,55.646223,37.385978
"Москва, Дмитровское ш., вл. 107, стр. 1А",41.2,193932,55.881192,37.538736
"Москва, ул. Илимская, вл. 3/5, стр. 7.1",79.7,123000,55.891083,37.568524
"Москва, Новочерёмушкинская ул., 58",81.3,209102,55.668224,37.563054
"Москва, 6-я Радиальная ул., 3к2",87.9,184187,55.606416,37.665686
"Москва, Рязанский пр-т, стр. 10",63.3,244224,55.726477,37.757916
"Москва, Мукомольный пр., 2",54.3,290976,55.75133,37.526887
"Москва, Люберцы, Вертолётная ул., 4/2",38.0,118421,55.706543,37.958537
"Москва, пос. Московский, дер. Румянцево, д. 1, вл. 17Е",81.5,127396,55.633963,37.425468
"Москва, пр-д Шмитовский, вл. 39",40.4,245121,55.755135,37.526986
"Москва, пос. Московский, дер. Румянцево, д. 3, вл. 17Е",30.3,157066,55.633963,37.425468
"Москва, пос. Московский, дер. Румянцево, д. 1, вл. 17Е",73.8,131438,55.633963,37.425468
"Москва, Москва, Береговой проезд, 5Ак5",74.0,310811,55.755348,37.510879
"Москва, Москва, г. Зеленоград, Георгиевский пр-кт, 33к6, Жемчужина Зеленограда",34.0,157353,55.96531,37.155901
"Москва, Москва, Каширское ш, 148к1",81.7,140636,55.59541,37.724373
"Москва, ул. Погодинская, д. 4",142.7,559297,55.734973,37.571013
"Москва, Шелепихинская наб., д. 34, корп. 2",71.4,287270,55.762789,37.508984
"Москва, пр-д 3-й Силикатный, стр. 2",83.7,221220,55.768512,37.498591
"Москва, Москва, Беловежская ул, 75",51.0,174510,55.707634,37.397979
"Москва, ул. Архитектора Щусева, 2к1",95.9,260688,55.699933,37.635377
"Москва, Дмитровское ш., ЖК «Тринити»",40.8,170004,55.856129,37.556595
"Москва, пр-т Волгоградский, вл. 32/3, стр. 2",24.7,223000,55.719876,37.694073
"Москва, пр-т Волгоградский, вл. 32/5, корп. А, стр. 4",60.1,180200,55.730725,37.670034
"Москва, ул. 3-я Хорошевская, стр. 3, вл. 19",51.9,179950,55.77876,37.500845
"Москва, Северо-Западный административный округ, район Покровское-Стрешнево",141.9,213319,55.823823,37.445779
"Москва, пр-д Тюменский, вл. 3-5",36.4,235324,55.811735,37.740722
"Москва, Рублёвское ш., 70к5",51.5,256311,55.770659,37.375234
"Москва, Москва,Москва,Северный (САО),Ленинградский проспект, 35 к1",122.0,286885,55.789461,37.551735
"Москва, Россия, Москва, Рассказовка, Новомосковский административный, поселение Внуковское, бульвар Андрея Тарковского, 9",91.5,147541,55.625211,37.345491
"Москва, Москва,Москва,Новомосковский (НМАО),Андрея Тарковского б-р, 9",42.7,173302,55.625211,37.345491
"Москва, Россия, Москва, Рассказовка, поселение Внуковское, улица Анны Ахматовой, 8",89.0,194382,55.637581,37.333399
"Москва, пос. Московский, дер. Румянцево, д. 2, вл. 17Е",42.3,147764,55.633963,37.425468
"Москва, ул. Тайнинская, вл. 9",33.2,150892,55.882409,37.681748
"Москва, пос. Совхоза имени Ленина, 17к3",68.0,148529,55.58582,37.729458
"Москва, ул. Илимская, вл. 3/5, стр. 9.1",79.4,123000,55.891083,37.568524
"Москва, Ленинский пр-кт, 111",80.0,316125,55.661328,37.509343
"Москва, ул. Муравская, д. 38, корп. 1",16.0,199375,55.864303,37.372368
"Москва, пр-д 3-й Автозаводский, вл. 13",128.0,286933,55.707522,37.655912
"Москва, ул. Бочкова, вл. 11А, корп. 3",57.4,204142,55.810405,37.62634
"Москва, Россия, Москва, Москва, 1-й Зачатьевский, 5, Хамовники",163.0,737247,55.739017,37.60381
"Москва, г Москва, ул Ландышевая, д 14 к 3",114.6,257417,55.88359,37.386328
"Москва, г Москва, проезд Шмитовский, д 39 к 3",43.9,375854,55.752936,37.524345
"Москва, Муравская ул., 42к2",80.2,128429,55.85961,37.372422
"Москва, Донецкая ул., 30к1",57.1,175131,55.645476,37.707215
"Москва, ул. Трофимова, 9к2",96.8,253099,55.704271,37.666674
"Москва, ул. Маршала Катукова, 24к1",76.0,384211,55.804476,37.414562
"Москва, Веерная ул., 6",74.0,297297,55.711519,37.489158
"Москва, Рязанский пр-т, 2/1к3К",94.1,179596,55.72817,37.738764
"Москва, Никулинская ул., 12к2",72.0,234722,55.670214,37.466979
"Москва, пр-т Маршала Жукова, 59",65.1,278034,55.777758,37.457987
"Москва, ул. Феодосийская, д. 7, корп. 3",84.1,177765,55.560866,37.57793
"Москва, ул. Лобачевского, вл. 120",69.5,205089,55.696128,37.469773
"Москва, Люберцы, ул. Камова, 12",29.5,144068,55.699446,37.959956
"Москва, ул. Берзарина, вл. 30",55.9,194704,55.790712,37.474444
"Москва, Смольная ул., 49",82.1,225932,55.863545,37.478459
"Москва, Озёрная ул., 9",161.0,204969,55.682351,37.461301
"Москва, пос. Московский, дер. Румянцево, д. 2, вл. 17Е",101.4,120319,55.633963,37.425468
"Москва, пос. Московский, дер. Румянцево, д. 3, вл. 17Е",76.4,112423,55.633963,37.425468
"Москва, ул. Паршина, вл. 10",78.9,218206,55.78975,37.456468
"Москва, Россия, Москва (МО г. Видное), мкр. Южный, 26",78.2,84399,55.77797,37.830509
"Москва, ул. Илимская, вл. 3/5, стр. 7.1",76.8,123000,55.891083,37.568524
"Москва, Рязанский пр-т, стр. 17",62.3,186840,55.730821,37.743247
"Москва, пр-т Академика Сахарова, 9",55.1,350000,55.772107,37.644701
"Москва, п. Сосенское, пос. Коммунарка, жилые дома",84.8,120164,55.570395,37.475495
"Москва, Россия, Москва г., улица Новодмитровская, 2к5",27.5,265455,55.80357,37.591027
"Москва, п. Филимонковское, дер. Староселье, стр. 4",29.9,136987,55.553809,37.313484
"Москва, Рязанский пр-т, стр. 15",49.0,181152,55.730912,37.742555
"Москва, Ильменский пр., вл. 14, стр. Д",33.4,218263,55.861524,37.5425
"Москва, Москва, Калининско-Солнцевская линия, метро Солнцево",54.0,187222,55.649383,37.3909
"Москва, ул. Лобачевского/платформа «Матвеевская», стр. 1",98.5,214660,55.664274,37.506684
"Москва, Первомайская ул., 42",103.1,258487,55.792265,37.787111
"Москва, Московская область, город Люберцы, микрорайон Зенино ЖК Самолёт, улица Дружбы, дом 5/2",27.0,142593,55.703895,37.962382
"Москва, Россия, Москва, улица Лавочкина, 34",140.0,278571,55.856295,37.493919
"Москва, дер. Десна, д. 55",38.0,110526,55.523315,37.373455
"Москва, Мосфильмовская ул., 88к2с4",46.0,391304,55.704093,37.493156
"Москва, Россия, Москва, Еропкинский переулок, 16/23",190.0,894737,55.740451,37.592716
"Москва, Россия, Москва, Рассказовка, поселение Внуковское, бульвар Андрея Тарковского, 9",43.0,181395,55.625211,37.345491
"Москва, Россия, Москва г., бульвар Ходынский, 2",99.6,271084,55.789391,37.536823
"Москва, Наставнический пер., 6",99.0,333333,55.751568,37.662964
"Москва, ул. Дыбенко, 38к1",125.0,172376,55.876698,37.484056
"Москва, пос. Московский, дер. Румянцево, д. 1, вл. 17Е",57.8,151559,55.633963,37.425468
"Москва, пр-д Тюменский, вл. 3-5",44.7,205931,55.811735,37.740722
"Москва, ул. Василия Ощепкова, 4",37.7,144907,55.554236,37.465838
"Москва, Огородный пр-д, вл. 20",93.2,200000,55.821871,37.593659
"Москва, Россия, Москва г, Краснодарская ул, д. 48",75.3,159363,55.676544,37.761177
"Москва, Россия, Москва г, Милашенкова ул, д. 12, корп. б",93.2,254292,55.827747,37.5842
"Москва, Россия, Москва г, Куркино п, Родионовская ул, д. 2, корп. 1",186.0,150538,55.895242,37.399713
"Москва, Россия, Москва г, Римского-Корсакова Улица, д. 11, корп. 8",68.6,170554,55.875925,37.603424
"Москва, ул. Краснобогатырская, вл. 38",54.8,185200,55.810364,37.702535
"Москва, ул. Багрицкого, 10к4",47.9,240000,55.72347,37.433184
"Москва, ул. Погодинская, д. 4",178.6,950564,55.734973,37.571013
"Москва, ул. Сельскохозяйственная, вл. 38",86.0,248837,55.848246,37.627696
"Москва, пос. Московский, дер. Румянцево, д. 3, вл. 17Е",59.5,130543,55.633963,37.425468
"Москва, пос. Московский, дер. Румянцево, д. 2, вл. 17Е",99.2,121326,55.633963,37.425468
"Москва, Кутузовский пр-т, вл. 12, стр. 19",95.6,575314,55.74904,37.558059
"Москва, ул. Большая Полянка",80.0,125000,55.736164,37.619432
"Москва, пос. Коммунарка, ул. Потаповская Роща, 2к1",37.3,182306,55.545452,37.493865
"Москва, Янтарный пр.",78.0,165385,55.869738,37.684793
"Москва, Люберцы, Вертолётная ул., 24",30.8,133117,55.703008,37.966298
"Москва, пр-т Вернадского, 97к3",148.4,235849,55.667122,37.490245
"Москва, Рождественская ул., 21к2",23.0,139130,55.704874,37.916927
"Москва, Москва, Замоскворецкая линия, метро Белорусская",45.7,365000,55.777388,37.582206
"Москва, ул. Сергея Макеева, 9",47.0,447600,55.761558,37.549067
"Москва, ул. Автозаводская, стр. 17",38.1,293822,55.704737,37.654349
"Москва, ул. Петра Алексеева, вл. 12, блок-секция 4",36.6,215552,55.717006,37.428791
"Москва, ул. Лобачевского/платформа «Матвеевская», стр. 1",65.7,238750,55.664274,37.506684
"Москва, Россия, Москва, Щукинская, Живописная улица, 21А",122.7,366748,55.793348,37.448581
"Москва, Россия, Москва, Баррикадная, улица Красная Пресня, 7",116.0,344828,55.760246,37.573492
"Москва, Россия, Москва, Ясный проезд, 25к2",39.0,192308,55.879263,37.61821
"Москва, ул. Сергея Макеева, вл. 9",45.3,455100,55.761558,37.549067
"Москва, Москва, Рязанский пр-кт, 2/1к2Б",62.8,200637,55.72887,37.739555
