address,area,price,longtitude,latitude
"Москва, Россия, Москва, Ивантеевская улица, 5к1",65.3,211332,55.820738,37.718229
"Москва, Россия, Москва, улица Демьяна Бедного, 4к2",119.0,217647,55.770375,37.489859
"Москва, ш. Энтузиастов, д. 3, корп. 2",56.6,253832,55.763457,37.771337
"Москва, ул. Погодинская, д. 4",145.4,824706,55.734973,37.571013
"Москва, пр-д 3-й Силикатный, стр. 2",45.3,248830,55.768512,37.498591
"Москва, пр-т Волгоградский, вл. 32/3, стр. 2",54.0,206900,55.719876,37.694073
"Москва, пр-т Волгоградский, вл. 32/3, стр. 1",55.6,193300,55.71946,37.694405
"Москва, Россия, Москва, Октябрьское поле, Щукино, улица Берзарина, 28Ак3",54.6,191170,55.790049,37.475522
"Москва, Производственная ул.",84.0,132143,55.645979,37.384379
"Москва, ул. Вавилова, д. 69А",147.9,312635,55.681047,37.551088
"Москва, ул. Михайлова, вл. 31",97.1,188194,55.725133,37.775263
"Москва, дер. Рассказовка, б-р Андрея Тарковского, стр. 14",66.2,152000,55.627265,37.342427
"Москва, дер. Рассказовка, б-р Андрея Тарковского, д. 9",44.9,155000,55.625272,37.342454
"Москва, город Москва, Ростокино район, проспект Мира, дом 188Б, корпус 1",109.2,160256,55.834472,37.65805
"Москва, Россия, Москва, Ленинградский проспект, 29к3",65.0,295385,55.784303,37.562775
"Москва, ул. Генерала Белобородова, 21",53.0,198113,55.835397,37.358929
"Москва, 3-й Павелецкий пр., 3",60.0,250000,55.710945,37.643821
"Москва, Рязанский пр-т, 2/1к2Г",52.0,221154,55.728515,37.737587
"Москва, Павелецкая наб., д. 6А",87.5,263427,55.710377,37.646031
"Москва, ул. Архитектора Щусева, 2к3",70.0,371429,55.700613,37.633634
"Москва, Дмитровское ш., 71к3",24.2,196409,55.855361,37.559388
"Москва, ул. Автозаводская/Архитектора Щусева/наб. Марка Шагала, ЖК «ЗИЛАРТ»",107.7,286267,55.69346,37.630598
"Москва, Шелепихинская наб., д. 34, корп. 2",70.3,268442,55.762789,37.508984
"Москва, Москва, Казачий 2-й переулок, 6",219.0,753425,55.733295,37.620941
"Москва, ул. Берзарина, д. 28А",114.4,222000,55.790939,37.475495
"Москва, п. Сосенское, пос. Коммунарка, стр. 8.5",40.5,148949,55.57236,37.475603
"Москва, мкр. 2Г, стр. 17",44.5,258879,55.755814,37.617635
"Москва, Москва, Кутузовский проспект, 4/2",65.0,400000,55.750727,37.562272
"Москва, Большая Почтовая ул., 16",59.0,288136,55.775773,37.692716
"Москва, пр-т Волгоградский, вл. 32/3, стр. 6",49.5,208000,55.72127,37.694253
"Москва, пр-т Волгоградский, вл. 32/3, стр. 3",49.5,207600,55.720231,37.693516
"Москва, Россия, Москва, Мичуринский проспект, 29",147.0,258503,55.696534,37.499408
"Москва, Россия, Москва, Флотская улица, 7к1",54.0,287037,55.854436,37.496129
"Москва, Россия, Москва, Таганская улица, 15с2",93.7,424760,55.740522,37.661958
"Москва, Россия, Москва, Синявинская улица, 11к15",56.0,139286,55.944621,37.349291
"Москва, дер. Рассказовка, б-р Андрея Тарковского, стр. 14",31.5,152000,55.627265,37.342427
"Москва, пос. Московский, дер. Румянцево, д. 1, вл. 17Е",72.7,131444,55.633963,37.425468
"Москва, ул. Берзарина, вл. 30",54.6,211077,55.790712,37.474444
"Москва, Ильменский пр., вл. 14, стр. Д",69.8,223436,55.861524,37.5425
"Москва, Россия, Москва, Бауманская, Басманный, Нижняя Красносельская улица, 35с49",52.3,299713,55.775545,37.672118
"Москва, пер. Средний Тишинский, стр. 1/1;1/1; 1,2; 1, вл. 5-7, 7-9, 5/7; 5",192.7,890320,55.769884,37.578271
"Москва, Россия, Москва г, Удальцова ул, д. 46",200.6,398804,55.684975,37.49206
"Москва, Москва Москва Большая Очаковская 12к3",87.1,142365,55.68803,37.460924
"Москва, Россия, Москва г, Красноказарменная ул, д. 8",45.0,244444,55.758139,37.695735
"Москва, Люберцы, ул. Дружбы, 5/1",37.0,129730,55.702977,37.962498
"Москва, Россия, Москва, Москва, Хорошевское ш, 12К1, Хорошёвский",71.6,258380,55.774745,37.548609
"Москва, Россия, Москва, Москва, Генерала Карбышева б-р, 13А, Хорошёво-Мнёвники",43.5,410805,55.78119,37.468856
"Москва, Чертановская ул., 43к4",68.0,183824,55.608384,37.593318
"Москва, ул. Коломенская, д. 12, корп. 1",51.0,171471,55.680686,37.696292
"Москва, б-р Ореховый, вл. 24, корп. 2, стр. 1",20.2,279080,55.613107,37.742977
"Москва, ул. Лобачевского, стр. 2",27.4,300590,55.665792,37.510718
"Москва, ул. Лобачевского/платформа «Матвеевская», стр. 1",46.9,230291,55.664274,37.506684
"Москва, ул. Лобачевского, ЖК «Река»",60.4,507440,55.676412,37.484487
"Москва, ул. Погодинская, д. 4",67.4,662193,55.734973,37.571013
"Москва, ул. Малая Пироговская, д. 8",97.4,664651,55.72961,37.570474
"Москва, ул. Верхняя, д. 20, корп. 1",107.6,364930,55.77919,37.574309
"Москва, пр-д Невельского/ ш. Энтузиастов/ул. Золоторожский Вал, жилые дома",25.9,258912,55.751193,37.685934
"Москва, ул. Верхняя, д. 22",345.1,539796,55.780026,37.572028
"Москва, ул. Шеногина/Шелепихинская наб., стр. 6",49.2,345417,55.750829,37.522836
"Москва, ул. Минская, д. 2",97.5,387030,55.716037,37.503998
"Москва, пр-д 3-й Силикатный, стр. 2",44.4,252860,55.768512,37.498591
"Москва, Ильменский пр., вл. 14, стр. В",72.2,234935,55.861524,37.5425
"Москва, мкр. 2Г, стр. 17",29.3,296068,55.755814,37.617635
"Москва, Автозаводская ул., 23к7",40.0,202500,55.703773,37.640066
"Москва, Москва,Москва,Юго-Западный (ЮЗАО),Вавилова, 81 к1",128.0,257031,55.679417,37.546111
"Москва, Россия, Москва, Коньково, Теплый Стан, Профсоюзная улица, вл128к2",49.6,179274,55.630441,37.515281
"Москва, Москва, Маленковская ул, 3",160.0,281250,55.790469,37.672594
"Москва, Москва, Андропова пр-кт., 10",27.4,273986,55.694292,37.665713
"Москва, Строгинский б-р",55.0,200000,55.804724,37.399605
"Москва, Россия, Москва, Речной вокзал, Левобережный, Ленинградское шоссе, 94к2",96.3,187954,55.855785,37.471704
"Москва, Абрамцевская ул., 10",39.0,220513,55.89555,37.574804
"Москва, ул. Недорубова, 14",23.0,134348,55.702054,37.93466
"Москва, пос. Московский, дер. Румянцево, д. 2, вл. 17Е",81.3,116397,55.633963,37.425468
"Москва, Ленинский пр-т, 103",307.0,219544,55.665969,37.51432
"Москва, Муравская ул., 42к3",84.2,148456,55.858963,37.37297
"Москва, Москва, Докучаев пер, 2к3",59.4,260943,55.774548,37.641566
"Москва, Москва, Генерала Белобородова ул, 17",150.0,186667,55.835953,37.357124
"Москва, Москва, г. Зеленоград, 128",43.0,137209,56.003457,37.208066
"Москва, Юго-Восточный административный округ, район Лефортово",71.0,263380,55.753635,37.704817
"Москва, ул. Никулинская, вл. 11Г, стр. 1",22.8,219123,55.664497,37.451645
"Москва, Ильменский пр., вл. 14, стр. Д",50.8,232363,55.861524,37.5425
"Москва, пос. Московский, дер. Румянцево, д. 3, вл. 17Е",97.9,117330,55.633963,37.425468
"Москва, Рублёвское ш., 70к5",62.5,236800,55.770659,37.375234
"Москва, пос. Московский, дер. Румянцево, д. 1, вл. 17Е",57.8,151559,55.633963,37.425468
"Москва, пр-д 1-й Грайвороновский, вл. 1",84.5,132500,55.718922,37.727014
"Москва, Россия, Москва, Красноказарменная улица, 14Ак2",49.0,295102,55.753225,37.706973
"Москва, ул. Академика Пилюгина, 20к1",97.0,242268,55.668726,37.532628
"Москва, ул. Шереметьевская, стр. 1, вл. 62",38.0,196053,55.794259,37.614976
"Москва, Россия, Москва г, Мичуринский пр-кт, д. 34",75.0,373333,55.69834,37.498025
"Москва, Нижняя Красносельская ул., 35с49",38.6,270000,55.775545,37.672118
"Москва, Россия, Москва г, Азовская ул, д. 24, корп. 2",155.0,200000,55.650836,37.597387
"Москва, Истринская ул., 8к3",84.0,245238,55.735657,37.432537
"Москва, Большая Переяславская ул., 9",43.4,264055,55.783301,37.641351
"Москва, Новоалексеевская ул., 22к1",59.0,457627,55.810531,37.653658
"Москва, Ленинградское ш., 25к3",76.0,261842,55.828162,37.487874
"Москва, Московская область, Одинцовский городской округ, рабочий посёлок Новоивановское",33.5,123552,55.706092,37.362559
"Москва, дер. Алхимово, стр. 1",35.1,122507,55.474393,37.509784
"Москва, ул. Гарибальди, 28к1",55.0,296364,55.670097,37.550217
"Москва, Хорошёвское ш., 25к3",38.6,323834,55.775307,37.527238
"Москва, Покровская ул.",34.8,140805,55.702886,37.928362
"Москва, ул. Мельникова, 3к5",70.0,278571,55.725169,37.676134
"Москва, Карамышевская наб., 2А",84.1,200951,55.769135,37.494521
"Москва, ул. Академика Павлова, стр. 30",124.0,197581,55.74634,37.407106
"Москва, Балаклавский пр-т, 2А",52.0,163462,55.642332,37.618174
"Москва, г Москва, ул Флотская, д 7 стр 1",77.0,201299,55.854062,37.497198
"Москва, г Москва, ул Радиальная 6-я, д 5 к 2",84.0,160714,55.604605,37.658751
"Москва, Рязанский пр-т, 2/1к4П",37.5,234667,55.726553,37.739249
"Москва, Россия, Москва, Волоколамская, Митинская улица, 10к1",41.4,210145,55.840791,37.379043
"Москва, Россия, Москва, Кунцевская, Ельнинская улица, 14к1",59.7,259631,55.737355,37.425782
"Москва, Никулинская ул., 12к1",78.3,240102,55.669529,37.467527
"Москва, Москва г, Лобачевского ул, 118К2",45.0,239700,55.694449,37.470581
"Москва, Москва г, Рублевское ш, 70К7",52.0,236538,55.770897,37.37809
"Москва, Москва г, Лазоревый проезд, 5К1",65.0,284615,55.847861,37.635206
"Москва, пр-д Береговой, вл. 3",76.0,247368,55.757318,37.50787
"Москва, Привольная ул., 23",120.0,175000,55.697351,37.845044
"Москва, Москва г, Крутицкий 4-й пер, д. 14",255.0,294118,55.729062,37.659892
"Москва, Россия, Москва г, Ходынский Бульвар, д. 2, корп. Ж",47.5,294737,55.789391,37.536823
"Москва, Донецкая ул., 30к1",58.0,181034,55.645476,37.707215
"Москва, Россия, Москва, Москва, Поляны ул, 5",56.0,158036,55.757364,37.952383
"Москва, Россия, Москва, Профсоюзная, Ломоносовский, улица Вавилова, 69А",67.6,350079,55.681047,37.551088
"Москва, Автозаводская ул., 23с931к2",40.0,254750,55.689811,37.657224
"Москва, Россия, Москва, Пресненский, 1-й Красногвардейский проезд, вл17-18",45.5,542642,55.751143,37.533733
"Москва, Шмитовский пр., 39к1",30.0,315000,55.754618,37.524058
"Москва, Россия, Москва, бульвар Маршала Рокоссовского, 6к1",91.0,240659,55.809934,37.727885
"Москва, Волоколамское ш., д. 71/8",113.0,163779,55.821077,37.430462
"Москва, Москва, Энтузиастов ш, 3к2, ЖК Символ",73.9,215697,55.74824,37.692995
"Москва, ул. Цимлянская, вл. 3, стр. 2.2",20.0,255000,55.669772,37.772011
"Москва, Россия, Москва, Солнцевский проспект, 6к1",78.1,192049,55.653908,37.400153
"Москва, Люберцы, Вертолётная ул., 16/1",49.9,132265,55.706152,37.964214
"Москва, Нижняя Красносельская ул., 35с50",52.0,363462,55.774684,37.674067
"Москва, Первомайская ул., 112",142.0,190070,55.793116,37.816944
"Москва, г Москва, мкр Чертаново Северное, д 1А",100.0,285000,55.637393,37.600388
"Москва, Симферопольский пр., 18",104.0,229808,55.665162,37.613952
"Москва, пос. Московский, дер. Румянцево, д. 3, вл. 17Е",97.2,117332,55.633963,37.425468
"Москва, Новочерёмушкинская ул., 58",88.9,207006,55.668224,37.563054
"Москва, ш. Дмитровское, вл. 1",89.5,243352,55.920487,37.54135
"Москва, пос. Московский, дер. Румянцево, д. 1, вл. 17Е",84.8,126381,55.633963,37.425468
"Москва, ул. Расплетина, 21",65.0,653846,55.798257,37.48199
"Москва, Россия, Москва, Бауманская, Басманный, Нижняя Красносельская улица, 35с49",48.8,301230,55.775545,37.672118
"Москва, Мукомольный пр., 2",76.5,283660,55.75133,37.526887
"Москва, Люберцы, Озёрная ул., 9",39.0,135897,55.700375,37.956076
"Москва, Москва, 3-й Павелецкий проезд, 3",86.5,271676,55.710945,37.643821
"Москва, пр-т. Рязанский, вл. 2",37.0,202703,55.729417,37.743148
"Москва, Россия, Москва, Москва, Береговой проезд, 5АК6",57.0,312281,55.909125,37.489886
"Москва, Россия, Москва, Дмитровское шоссе, 107Ак1",40.0,221250,55.879495,37.539877
"Москва, пр-т Волгоградский, вл. 32/3, стр. 1",34.0,213235,55.71946,37.694405
"Москва, ул. Юннатов, вл. 4",37.6,293000,55.798439,37.563718
"Москва, б-р Маршала Рокоссовского",72.0,229861,55.813207,37.721552
"Москва, г.п. Рязановское, с. Остафьево, стр. 5",37.0,145946,55.49417,37.502058
"Москва, б-р Андрея Тарковского, 9",65.0,153846,55.625211,37.345491
"Москва, Огородный пр-д, вл. 20",39.2,226200,55.821871,37.593659
"Москва, Россия, Москва, Профсоюзная, Ломоносовский, улица Вавилова, 69А",53.7,312708,55.681047,37.551088
"Москва, ул. Недорубова, 14",23.0,139130,55.702054,37.93466
"Москва, ул. Пресненский Вал, 21",135.0,286667,55.77155,37.568893
"Москва, Россия, Москва, Пресненский, 1-й Красногвардейский проезд, вл17-18",51.4,462090,55.751143,37.533733
"Москва, Москва г, Внуковское п, Рассказовка д, Андрея Тарковского б-р, 4",66.0,140152,55.62849,37.341287
"Москва, Москва, Попов проезд, 1к2",104.0,317308,55.784435,37.694675
"Москва, Россия, Москва, метро Балтийская, Береговая улица, 8к1",124.0,423387,55.832682,37.468793
"Москва, Москва,Москва,Западный (ЗАО),Производственная, 10 к2",40.5,186914,55.643144,37.38499
"Москва, ш. Варшавское, вл. 170Е, корп. 6",40.6,219000,55.58381,37.580616
"Москва, Ходынский б-р, 20А",47.0,280851,55.790777,37.523204
"Москва, Москва,Москва,Северо-Западный (СЗАО),Берзарина, 28а к4",85.0,235294,55.789598,37.475737
"Москва, Москва,Москва,Северный (САО),Ленинградское ш., 69",55.1,239564,56.131546,37.067282
"Москва, Москва,Москва,Восточный (ВАО),Маршала Рокоссовского бульвар, 6 к1в",80.0,249375,55.814264,37.735117
"Москва, Москва,Москва,Юго-Западный (ЮЗАО),Новаторов, 4",78.7,270648,55.669254,37.521758
"Москва, Москва,Москва,Северный (САО),Соломенной Сторожки проезд, 5 к1",187.0,326203,55.808781,37.564841
"Москва, Москва, Энтузиастов ш, 1к2, ЖК Символ",51.0,240196,55.747703,37.688297
"Москва, пр-д 3-й Силикатный, стр. 1",55.7,240194,55.768107,37.495815
"Москва, Москва, Нахимовский пр-кт, 73",145.7,212080,55.682453,37.552373
"Москва, ул. Покровская, д. 17А, корп. 2",18.5,154054,55.698939,37.934929
"Москва, Совхозная ул., 49",40.0,205000,55.67856,37.761411
"Москва, Мосфильмовская ул., 88к2с5",79.0,460759,55.704935,37.492105
"Москва, Старокачаловская ул., 16",148.0,202365,55.57007,37.587883
"Москва, Россия, Москва, Комсомольская, Красносельский, Басманный переулок, 5",73.8,255500,55.771206,37.658212
"Москва, Береговой пр., 5Ак4",33.0,454545,55.755778,37.510619
"Москва, пр-т Мичуринский, стр. 3",70.9,296192,55.704509,37.512838
"Москва, ул. 3-я Хорошёвская, д. 25, корп. 4",112.3,180766,55.785275,37.493793
"Москва, Ленинский пр-т, 123",74.5,271812,55.646899,37.479699
"Москва, ул. Муравская, д. 38, корп. 2",34.2,172515,55.862681,37.37244
"Москва, Россия, Москва, Старокачаловская улица, 6",105.0,176190,55.569164,37.588377
"Москва, Россия, Москва, Живописная улица, 21А",88.0,369318,55.793348,37.448581
"Москва, ул. Новочерёмушкинская, д. 17, корп. 4",83.8,310456,55.683315,37.581963
"Москва, пр-д Тюменский, вл. 3-5",53.5,197446,55.811735,37.740722
"Москва, Россия, Москва, Зеленоград, Георгиевский проспект, 37к2",57.0,133316,55.966912,37.150646
"Москва, Россия, Москва, улица Расплетина, 21",105.0,406667,55.798257,37.48199
"Москва, Россия, Москва г, Карамышевская наб, д. 34",71.0,330986,55.76919,37.472674
"Москва, Юго-Восточный административный округ, район Лефортово",93.0,252688,55.753635,37.704817
"Москва, пр-т Волгоградский, вл. 32/5, корп. А, стр. 4",81.0,180600,55.730725,37.670034
"Москва, пос. Московский, дер. Румянцево, д. 3, вл. 17Е",64.1,119504,55.633963,37.425468
"Москва, ул. Цимлянская, д. 3, корп. 1",24.5,214286,55.670844,37.775433
"Москва, Огородный пр-д, вл. 20",93.2,171700,55.821871,37.593659
"Москва, Московская обл, г Люберцы, ул Вертолетная, д.18, корп.1",33.0,124242,55.705559,37.964897
"Москва, ул. Крылатские Холмы, 15к2",190.0,421053,55.751867,37.416871
"Москва, Дмитровское ш., 71к3",51.2,166643,55.855361,37.559388
"Москва, ул. Маломосковская, д. 14",48.0,281250,55.812752,37.647549
"Москва, Ландышевая ул., 14к1",45.0,231111,55.88461,37.388421
"Москва, Россия, Москва, Улица Скобелевская, Южное Бутово, Старокрымская улица, 15к1",72.3,169101,55.557948,37.557268
"Москва, д. Жабкино, жилой квартал Булатниково",33.5,132836,55.560718,37.6251
"Москва, 1-й Нагатинский пр.",123.0,218699,55.678494,37.633032
"Москва, Россия, Москва, Речной вокзал, Флотская улица, 7к3",79.0,136709,55.854825,37.497018
"Москва, Московская область, городской округ Люберцы, деревня Марусино, Заречная улица, 37к5",36.0,105278,55.691131,37.970242
"Москва, Вешняковская ул., 18к1",52.2,219958,55.723607,37.824032
"Москва, Москва, Кочновский проезд, 4к1",100.0,235000,55.806687,37.542949
"Москва, Москва, Юго-Западный административный округ, Ломоносовский район, жилой комплекс Версис",95.4,249895,55.682031,37.552714
"Москва, 6-я Радиальная ул., вл7к1",71.0,164789,55.606899,37.659101
"Москва, город Москва, Мещанский район, улица Троицкая, дом 8",140.0,607143,55.774472,37.622145
"Москва, город Москва, Головинский район, бульвар Кронштадтский, дом 6, корпус 2",44.0,240909,55.841261,37.494422
"Москва, Москва, Жуков проезд, 21кБ, ЖК Level Павелецкая",70.0,237129,55.722644,37.646022
"Москва, Москва, Татьянин Парк, 12к7",47.0,185106,55.654899,37.423033
"Москва, ул. Авиационная, д. 77, корп. 2",99.3,253924,55.809348,37.450863
"Москва, пр-т Волгоградский, вл. 32/3, стр. 5",93.6,216900,55.720378,37.688
"Москва, ул. Донецкая, д. 30, корп. 2",61.5,151220,55.646223,37.705832
"Москва, пр-т Волгоградский, вл. 32/3, стр. 3",43.2,233796,55.720231,37.693516
"Москва, пр-т Волгоградский, вл. 32/3, стр. 4",53.0,226415,55.720601,37.693534
"Москва, пр-т Волгоградский, вл. 32/3, стр. 6",40.2,223881,55.72127,37.694253
"Москва, пр-д Тюменский, вл. 3-5",35.4,227378,55.811735,37.740722
"Москва, Россия, Москва г, Мичуринский пр-кт, д. 13, корп. 1",50.0,309800,55.697934,37.512532
"Москва, Россия, Москва г, Можайское ш, д. 50",50.0,160000,55.717224,37.405049
"Москва, Ярославское ш., 146к2",40.0,110000,55.878804,37.729988
"Москва, Москва, Автозаводская улица, 23с931к2",55.5,261261,55.689811,37.657224
"Москва, г Москва, Хорошёвское шоссе, д 12 к 1",51.7,356867,55.774745,37.548609
"Москва, г Москва, пр-кт Маршала Жукова, д 41",133.5,208914,55.775049,37.469692
"Москва, г Москва, ш Ленинградское, д 94 к 2",40.0,268750,55.855785,37.471704
"Москва, г Москва, пр-кт Мичуринский, д 34",48.4,398760,55.69834,37.498025
"Москва, г Москва, б-р Жулебинский, д 5",90.0,199444,55.698553,37.8449
"Москва, г Москва, ул Ягодная, д 6",57.0,173684,55.576574,37.675828
"Москва, г Москва, ул Веерная, д 4 к 2",51.4,359922,55.712244,37.488341
"Москва, г Москва, ул Герасима Курина, д 26",74.0,229054,55.730289,37.464796
"Москва, г Москва, ул Ходынская, д 2",66.0,333333,55.770806,37.564212
"Москва, г Москва, ш Хорошёвское, д 12 стр 1",71.0,364789,55.774745,37.548609
"Москва, г Москва, ул Добролюбова, д 15/21",65.1,176651,55.816374,37.592375
"Москва, г Москва, Мичуринский пр-кт, д 3",84.0,500000,55.704509,37.512838
"Москва, г Москва, ул Веерная, д 2",62.5,271200,55.712888,37.489446
"Москва, г Москва, пр-кт Ленинский, д 111 к 1",75.0,292000,55.661328,37.509343
"Москва, г Москва, б-р Генерала Карбышева, д 13А",43.0,415581,55.78119,37.468856
"Москва, г Москва, проезд Береговой, д 5 к 2",60.0,333333,55.756376,37.508975
"Москва, г Москва, пр-кт Маршала Жукова, д 43 к 3",55.0,312727,55.774219,37.468775
"Москва, г Москва, ул Красносельская Нижн., д 35 стр 48",70.0,334286,55.774948,37.67298
