address,area,price,longtitude,latitude
"Москва, Рождественская ул., 33",60.0,150000,55.703185,37.931713
"Москва, ул. Верхние Поля, 34к1",39.0,179487,55.667762,37.761923
"Москва, ул. 1-я Мясниковская, вл. 2",56.0,262500,55.81648,37.702158
"Москва, Россия, Москва, Москва, Минская ул, 1г к2",132.0,325758,55.712122,37.499067
"Москва, Россия, Москва, Москва, Подсосенский пер, 11",125.0,532000,55.757556,37.651592
"Москва, Россия, Москва, Москва, Староволынская ул, 12к2, Очаково-Матвеевское",625.0,312320,55.714186,37.477031
"Москва, Россия, Москва, Москва, Нежинская ул, 1к2, Фили-Давыдково",80.0,337500,55.719313,37.478019
"Москва, ул. Солянка, стр. 7, стр. 1",125.1,1050000,55.752409,37.64039
"Москва, пр-д Береговой, вл. 3",71.0,273239,55.757318,37.50787
"Москва, Головинское ш., 7",27.0,292593,55.839572,37.493183
"Москва, ул. Лобачевского, вл. 120",52.8,290261,55.696128,37.469773
"Москва, Юго-Восточный административный округ, район Некрасовка",34.8,152299,55.683793,37.928704
"Москва, ул. Берзарина, вл. 30",56.1,214962,55.790712,37.474444
"Москва, ш. Дмитровское, вл. 1",57.0,231754,55.920487,37.54135
"Москва, Ильменский пр., вл. 14, стр. Д",27.1,243410,55.861524,37.5425
"Москва, пос. Московский, дер. Румянцево, д. 3, вл. 17Е",61.1,121529,55.633963,37.425468
"Москва, ул. Лобачевского, вл. 120",40.5,271132,55.696128,37.469773
"Москва, ш. Варшавское, вл. 170Е, корп. 3",77.8,196658,55.583072,37.582179
"Москва, Дмитровское ш., 71с1",40.0,130000,55.855199,37.560502
"Москва, Покровская ул.",38.4,143177,55.702886,37.928362
"Москва, Балаклавский пр-т, 16",66.0,242424,55.642199,37.60452
"Москва, Валдайский пр., 12",11.0,200000,55.866788,37.468901
"Москва, Россия, Москва г, Донецкая Улица, д. 30, корп. 1",37.5,174667,55.645476,37.707215
"Москва, Россия, Москва г, Набережная Б. ул, д. 19, корп. 1",45.0,211111,55.831949,37.459415
"Москва, пр-д Багратионовский, стр. 3",41.0,256098,55.744992,37.510152
"Москва, пр-т Мичуринский, стр. 2",51.1,293198,55.715814,37.534316
"Москва, ул. Производственная, вл. 6, стр. 3",58.6,158703,55.646223,37.385978
"Москва, ул. Архитектора Щусева, д. 2, корп. 2",134.8,378338,55.699106,37.634721
"Москва, ул. Архитектора Щусева, д. 2, корп. 3",68.8,261628,55.700613,37.633634
"Москва, пос. Московский, дер. Румянцево, д. 2, вл. 17Е",99.2,121326,55.633963,37.425468
"Москва, пр-д Шмитовский, вл. 39, корп. 2",30.0,298333,55.754618,37.524058
"Москва, Большая Серпуховская ул., 36",53.3,364916,55.723856,37.625298
"Москва, ул. Лосиноостровская, вл. 45, стр. 4",51.0,117647,55.83749,37.753254
"Москва, пос. Московский, дер. Румянцево, д. 1, вл. 17Е",62.3,140518,55.633963,37.425468
"Москва, наб. Марка Шагала",81.0,207901,55.69346,37.630598
"Москва, Москва, Замоскворецкая линия, метро Водный стадион",64.0,187344,55.839881,37.486769
"Москва, пер. Холодильный, вл. 2/6, стр. 3",36.0,319444,55.709414,37.624058
"Москва, Россия, Москва, Кунцевская, Рябиновая улица, 3к4",63.8,203421,55.717883,37.426573
"Москва, ул. Рябиновая, д. 3, корп. 2",64.7,222450,55.718816,37.426186
"Москва, Ленинградский пр-т, вл. 36",105.0,304762,55.791243,37.559379
"Москва, ул. Красных зорь, вл. 33А",72.0,200369,55.723121,37.432403
"Москва, ул. Производственная, вл. 6, стр. 9",33.5,181029,55.647254,37.386418
"Москва, 10 мин от М Алтуфьево, ЖК Новые Вешки",53.0,156604,55.912804,37.57157
"Москва, Россия, Москва, улица Короленко, 8",232.0,333621,55.795034,37.691728
"Москва, ул. Серпуховский Вал, 21к2",140.0,500000,55.710961,37.609227
"Москва, Россия, Москва, Октябрьское поле, Щукино, улица Берзарина, 28Ак3",82.5,193430,55.790049,37.475522
"Москва, Москва г, Новокосинская ул, 9К2",38.0,188158,55.733553,37.852904
"Москва, ул. Автозаводская, стр. 16",34.9,266308,55.704215,37.645196
"Москва, Москва г, Кочновский проезд, 4К1",69.0,249275,55.806687,37.542949
"Москва, пос. Московский, дер. Румянцево, д. 3, вл. 17Е",98.5,117328,55.633963,37.425468
"Москва, б-р Ореховый, вл. 24, корп. 2, стр. 2",25.8,231943,55.613107,37.742977
"Москва, ул. Маресьева, стр. 8",56.9,132192,55.711828,37.939412
"Москва, ул. Лобачевского, вл. 120",73.9,222911,55.696128,37.469773
"Москва, пос. Московский, дер. Румянцево, д. 2, вл. 17Е",76.8,118421,55.633963,37.425468
"Москва, Цимлянская ул., 3к1",59.0,159322,55.670844,37.775433
"Москва, Россия, Москва г., улица Минская, 1Г корп2",77.6,435567,55.712122,37.499067
"Москва, Россия, Москва г., улица Руднёвка, 43",83.0,144578,55.71765,37.89526
"Москва, Россия, Москва г., улица Наримановская, 8",45.0,220000,55.814588,37.70514
"Москва, Родионовская ул., 2к1",80.0,227500,55.895242,37.399713
"Москва, ул. Зорге, вл. 9, корп. 3",36.8,181331,55.781818,37.506639
"Москва, ул. Производственная, вл. 6, стр. 9",49.6,186350,55.647254,37.386418
"Москва, Салтыковская ул., 15к1",54.3,174954,55.737816,37.864789
"Москва, ул. Пресненский Вал, 14к5",136.0,435000,55.765529,37.569108
"Москва, ул. Юннатов, вл. 4",71.0,275000,55.798439,37.563718
"Москва, п. Внуковское, дер. Рассказовка, уч. 13/2, стр. 9",69.9,126078,55.631015,37.327866
"Москва, Дмитровское ш., вл. 71, корп. 3",36.7,176246,55.855361,37.559388
"Москва, Москва, Ленинградское ш, 25к2",64.0,312500,55.827671,37.487559
"Москва, Москва, Татьянин Парк, 14к1",45.0,226667,55.656346,37.424327
"Москва, Москва, Машиностроения 1-я ул, 10",53.0,315094,55.714191,37.670914
"Москва, Москва, Старокачаловская ул, 16",147.4,193351,55.57007,37.587883
"Москва, ул. Красных зорь, вл. 33А",106.0,210033,55.723121,37.432403
"Москва, Москва, Вешняковская ул., 18к1",37.0,194244,55.723607,37.824032
"Москва, Россия, Москва, Серпуховская, Люсиновская улица, 29с1",44.5,408989,55.724829,37.623151
"Москва, пр-т Мичуринский, стр. 3",76.5,279411,55.704509,37.512838
"Москва, Москва, Мосфильмовская ул, 88к4",82.0,341463,55.703185,37.491548
"Москва, ул. Донецкая, вл. 30, стр. 3",40.7,156827,55.64285,37.703649
"Москва, Зеленоград, Георгиевский пр-т, 37к1",34.0,166147,55.968,37.150583
"Москва, пр-т Мичуринский, стр. 2",136.4,303546,55.715814,37.534316
"Москва, пос. Московский, дер. Румянцево, д. 2, вл. 17Е",79.6,117406,55.633963,37.425468
"Москва, ул. Лобачевского/платформа «Матвеевская», стр. 1",46.9,251440,55.664274,37.506684
"Москва, пр-д 3-й Силикатный, стр. 2",21.4,279810,55.768512,37.498591
"Москва, пр-т Волгоградский, вл. 32/3, стр. 2",53.8,220400,55.719876,37.694073
"Москва, ш. Варшавское, вл. 170Е, корп. 3",47.5,178947,55.583072,37.582179
"Москва, ул. Алабяна, 13к1",73.0,289041,55.799937,37.505903
"Москва, Москва, Владимирская 2-я ул, 6к2",130.0,222308,55.761386,37.776817
"Москва, пр-т Мичуринский, стр. 2",78.2,289986,55.715814,37.534316
"Москва, Россия, Московская область, Булатниковское с/п, Дрожжино д, Новое ш, 12к1",34.0,113235,55.524681,37.596121
"Москва, пр-т Мичуринский, стр. 3",83.9,293820,55.704509,37.512838
"Москва, пос. Московский, дер. Румянцево, д. 3, вл. 17Е",64.0,120505,55.633963,37.425468
"Москва, Огородный пр-д, вл. 20",39.6,224200,55.821871,37.593659
"Москва, пос. Марьино, ул. Харлампиева, д. 50, корп. 3",29.0,155172,55.548706,37.311112
"Москва, пр-д Тюменский, вл. 3-5",39.5,211730,55.811735,37.740722
"Москва, Варшавское ш., 141к6",34.0,232353,55.590384,37.601672
"Москва, Москва,Москва,Юго-Западный (ЮЗАО),Ленинский проспект, 105 к4",34.5,342029,55.66342,37.517859
"Москва, пр-т Ленинский, жилые дома",65.0,281001,54.709304,39.546669
"Москва, Россия, Москва, Москва, Дмитровское ш, 107к4",110.0,190909,56.320268,37.49621
"Москва, Москва,Москва,Западный (ЗАО),Филёвский бульвар, 8 к1",52.0,211538,55.766238,37.490506
"Москва, Каширское ш., 65к2",20.5,192683,55.599728,37.724723
"Москва, ул. Зорге, вл. 9, корп. 3",27.6,229328,55.781818,37.506639
"Москва, ул. Автозаводская, стр. 14",51.1,219843,55.703834,37.648043
"Москва, г Москва, наб Академика Туполева, д 15",74.0,378378,55.760692,37.68217
"Москва, ул. Берзарина, вл. 30",83.0,215322,55.790712,37.474444
"Москва, Россия, Москва, улица Народного Ополчения, 11",73.0,315068,55.772416,37.4743
"Москва, 3-й Павелецкий пр., 3",38.0,235526,55.710945,37.643821
"Москва, Центральный административный округ, Пресненский район",30.0,373333,55.763432,37.562389
"Москва, Ходынский б-р, 2",47.0,300000,55.789391,37.536823
"Москва, Карамышевская наб., д. 2А",124.5,240161,55.769135,37.494521
"Москва, Пресненская наб., 12",105.8,569201,55.749511,37.537083
"Москва, п. Сосенское, пос. Коммунарка, стр. 8.4",87.1,101723,55.572986,37.475189
"Москва, Люберцы, ул. Дружбы, 5/2",27.0,148148,55.703895,37.962382
"Москва, Мукомольный пр., 2",59.7,304858,55.75133,37.526887
"Москва, Дмитровское ш., 169к3",34.4,190407,55.932344,37.542931
"Москва, Улица Староволынская, 12 корпус 3",205.0,272927,55.714622,37.476133
"Москва, п. Сосенское, пос. Коммунарка, стр. 5.4",92.1,119837,55.572986,37.475189
"Москва, п. Сосенское, пос. Коммунарка, стр. 8.5",43.4,152173,55.57236,37.475603
"Москва, п. Сосенское, пос. Коммунарка, стр. 6.4",68.0,128372,55.572986,37.475189
"Москва, п. Сосенское, пос. Коммунарка, стр. 7.4",42.0,130425,55.572986,37.475189
"Москва, пр-т Волгоградский, вл. 32/3, стр. 7",83.1,182400,55.721087,37.694836
"Москва, пос. Московский, дер. Румянцево, д. 3, вл. 17Е",60.1,121537,55.633963,37.425468
"Москва, Шелепихинская наб., д. 34, корп. 2",61.5,272283,55.762789,37.508984
"Москва, ул. Погодинская, д. 4",76.0,742016,55.734973,37.571013
"Москва, п. Сосенское, пос. Коммунарка, стр. 8.5",54.0,136897,55.57236,37.475603
"Москва, п. Сосенское, пос. Коммунарка, стр. 8.4",39.9,144349,55.572986,37.475189
"Москва, п. Сосенское, пос. Коммунарка, стр. 7.4",84.9,103445,55.572986,37.475189
"Москва, п. Сосенское, пос. Коммунарка, стр. 5.4",43.3,153055,55.572986,37.475189
"Москва, Переулок Дмитровский, 7",219.0,1826484,55.762333,37.616054
"Москва, п. Сосенское, пос. Коммунарка, жилые дома",47.7,155136,55.570395,37.475495
"Москва, п. Сосенское, пос. Коммунарка, стр. 5.5",59.1,133650,55.57236,37.475603
"Москва, ул. Большая Почтовая, вл. 30, 34",53.4,280337,55.77957,37.700154
"Москва, ул. Никитина/Бианки, стр. 8",37.0,132489,55.605861,37.361005
"Москва, ул. Никитина/Бианки, стр. 1",90.9,98204,55.605821,37.357851
"Москва, Производственная ул.",55.0,183636,55.645979,37.384379
"Москва, дер. Рассказовка, б-р Андрея Тарковского, стр. 14",31.5,156984,55.627265,37.342427
"Москва, Россия, Московская область, городской округ Солнечногорск, деревня Рузино, микрорайон Кутузовский, 1к1",38.1,129921,55.951336,37.1818
"Москва, Россия, Москва г, Шокальского проезд, д. 31, корп. 1",60.4,192053,55.881434,37.648843
"Москва, Россия, Москва, Мишина улица, 26",240.0,383333,55.795686,37.565865
"Москва, ул. Маресьева, стр. 9",59.0,122045,55.707978,37.930429
"Москва, пр-д Невельского/ ш. Энтузиастов/ул. Золоторожский Вал, жилые дома",25.9,257012,55.751193,37.685934
"Москва, ул. Верхняя, д. 20, корп. 1",118.3,363166,55.77919,37.574309
"Москва, ул. Авиационная, д. 77, корп. 2",80.6,269175,55.809348,37.450863
"Москва, ул. Минская, д. 2",96.9,389033,55.716037,37.503998
"Москва, ул. Викторенко, вл. 11",62.0,290323,55.795444,37.526896
"Москва, ул. Маршала Захарова, 3",40.0,262500,55.622766,37.706353
"Москва, ул. Паршина, вл. 10",71.3,271078,55.78975,37.456468
"Москва, Нахимовский пр-т, 56",275.0,320000,55.683407,37.555355
"Москва, Береговой пр., 5к1",80.0,235000,55.7559,37.506675
"Москва, Москва, Варшавское ш, 170Ек1",23.0,250870,55.582925,37.580032
"Москва, дер. Рассказовка, б-р Андрея Тарковского, стр. 14",32.9,178997,55.627265,37.342427
"Москва, Береговой пр., 5к3",94.0,250000,55.755474,37.507753
"Москва, ул. Маресьева, стр. 9",40.7,146646,55.707978,37.930429
"Москва, пр-д Жуков, д. 21Б",44.0,277273,55.722644,37.646022
"Москва, ул. Берзарина, жилые дома",60.9,177854,54.709304,39.546669
"Москва, ул.Нагорная, 6, Троицк",38.0,136842,55.493762,37.299605
"Москва, пр-т Ленинградский, д. 29, корп. 1",85.6,255841,55.785169,37.564033
"Москва, Ломоносовский пр-т, 29к1",99.5,442211,55.703611,37.516467
"Москва, Россия, Москва, Деловой центр, Пресненский, Пресненская набережная, 12",80.0,649000,55.749511,37.537083
"Москва, Россия, Москва, Павелецкая, Жуков проезд, вл21",32.6,319018,55.722685,37.64471
"Москва, Россия, Москва, Ботанический сад, Свиблово, проезд Серебрякова, 11-13к3",87.0,169471,55.848892,37.650325
"Москва, Россия, Москва, Черкизовская, Гольяново, Амурская улица, вл3",59.1,201861,55.808478,37.758797
"Москва, Дмитровское ш., 107Ак2",75.4,166446,55.878889,37.538637
"Москва, д. Раздоры, жилой комплекс Спутник",26.0,180769,55.799967,37.375674
"Москва, Россия, Москва, 6-я Радиальная улица, вл7к23",43.0,119767,55.605495,37.655688
"Москва, ул. Донецкая, вл. 30, стр. 3",39.1,164761,55.64285,37.703649
"Москва, ул. Юннатов, вл. 4",59.2,282100,55.798439,37.563718
"Москва, Москва г, Новомихалковский 1-й проезд, 2К1",73.0,246575,55.838152,37.539814
"Москва, ул. Живописная, д. 21А",113.4,313051,55.793348,37.448581
"Москва, ул. Красных зорь, вл. 33А",43.1,215761,55.723121,37.432403
"Москва, п. Внуковское, дер. Рассказовка, уч. 13/2, стр. 9",39.1,149651,55.631015,37.327866
"Москва, п. Внуковское, дер. Рассказовка, уч. 13/2, стр. 8",34.5,170457,55.631015,37.327866
"Москва, Авиационная ул., 77к1",141.1,333097,55.80742,37.450162
"Москва, Варшавское ш., 141к12",37.0,210811,55.588649,37.604448
"Москва, пр-т Ленинградский, д. 29, корп. 3",67.5,291852,55.784303,37.562775
"Москва, Россия, Москва, Москва, 3-я улица Ямского Поля ул, 9",300.0,250000,55.781626,37.580894
"Москва, б-р Андрея Тарковского, 6",78.2,136000,55.627265,37.342427
"Москва, ул. Илимская, вл. 3/5, стр. 7.1",39.5,129000,55.891083,37.568524
"Москва, пер. Средний Тишинский, стр. 1/1;1/1; 1,2; 1, вл. 5-7, 7-9, 5/7; 5",94.1,584930,55.769884,37.578271
"Москва, Огородный пр-д, вл. 20",87.9,190900,55.821871,37.593659
"Москва, пос. Московский, дер. Румянцево, д. 2, вл. 17Е",37.0,156873,55.633963,37.425468
"Москва, пр-т Волгоградский, вл. 32/5, корп. А, стр. 4",40.5,210000,55.730725,37.670034
"Москва, Москва, Юго-Западный административный округ, Ломоносовский район, жилой комплекс Версис",130.1,250019,55.682031,37.552714
"Москва, Южный административный округ, район Чертаново Северное, 5кБ",39.0,253846,55.637525,37.590389
"Москва, пр-д Тюменский, вл. 3-5",44.6,197309,55.811735,37.740722
"Москва, Дмитровское ш., вл. 107, стр. 1А",61.3,187210,55.881192,37.538736
"Москва, Дмитровское ш., вл. 107, стр. 1Б",68.9,140203,55.881192,37.538736
"Москва, пос. Московский, дер. Румянцево, д. 3, вл. 17Е",83.0,113389,55.633963,37.425468
"Москва, ул. Авиационная, д. 77, корп. 2",205.5,234286,55.809348,37.450863
"Москва, Россия, Москва г, Ленинский пр-кт, д. 111, корп. 1",49.0,326531,55.661328,37.509343
"Москва, Зеленоград, 2307А",58.1,134406,55.965546,37.191187
"Москва, 1-й Красногвардейский пр., вл17-18",69.2,450000,55.751143,37.533733
"Москва, Зеленоград, 2307Б",40.0,133375,55.96475,37.190819
"Москва, Авиационная ул., 79В",469.9,207810,55.807461,37.448465
"Москва, город Москва, Филевский парк район, проезд Береговой, дом 5А, корпус 6",57.0,312281,55.754978,37.510628
"Москва, ул. Удальцова, 73",141.9,422833,55.677656,37.497036
"Москва, Карамышевская наб., 48к3",53.4,284644,55.773044,37.46494
"Москва, Россия, Москва, Деловой центр, Пресненский, Пресненская набережная, 12",72.7,539202,55.749511,37.537083
"Москва, Россия, Москва, Кунцевская, Можайский, Можайское шоссе, 21к2",58.3,222642,55.719262,37.427884
"Москва, ул. Паршина, вл. 10",45.4,260872,55.78975,37.456468
"Москва, Московская область, город Люберцы, улица Вертолетная, дом 4, корпус 2",31.4,133758,55.706543,37.958537
"Москва, ул. Берзарина, вл. 30",81.9,188885,55.790712,37.474444
"Москва, Авиационная ул., 77",129.2,255418,55.807982,37.450845
"Москва, пр-т Ленинградский, вл. 31",57.5,304348,55.784977,37.56194
"Москва, пр. Невельского, 6к2",131.0,251908,55.752379,37.700137
"Москва, Хорошёвское ш., 16к2",90.0,277778,55.774254,37.546525
"Москва, рабочий пос. Бутово, жилой комплекс Бутово Парк, 22к1",67.0,126866,55.542268,37.584874
"Москва, ул. Краснобогатырская, вл. 38",62.5,184240,55.810364,37.702535
"Москва, Россия, Москва г., проезд Мукомольный, 2",87.2,251147,55.75133,37.526887
"Москва, Москва, Цимлянская ул, 3к1",102.0,150490,55.670844,37.775433
"Москва, Донецкая ул., 30к1",72.0,176667,55.645476,37.707215
"Москва, ул. Берзарина, 30к1",34.0,211765,55.790712,37.474444
"Москва, Волоколамское ш., 71к1",74.0,202027,55.822412,37.432043
"Москва, Волоколамское ш., 71к2",90.0,188333,55.821077,37.430462
"Москва, ул. Феодосийская, д. 7, корп. 1",43.0,183721,55.561741,37.577858
"Москва, Волоколамское ш., д. 71, корп. 1",74.0,205405,55.822412,37.432043
"Москва, Москва, Рязанский пр-кт, 2/1к3К",58.0,193103,55.72817,37.738764
"Москва, ул. Камова/Каштановая/Вертолетная, д. 54",40.6,97710,55.69901,37.958411
"Москва, ул. Камова/Каштановая/Вертолетная, д. 52",36.8,101250,55.69901,37.958411
"Москва, ул. Берзарина, вл. 30",36.8,225083,55.790712,37.474444
"Москва, Москва, Пресненская наб., д.8",291.8,394791,55.747115,37.539078
"Москва, Авиационная ул., 77к1",105.2,351711,55.80742,37.450162
"Москва, пр-д Шмитовский, вл. 39Б, стр. 1",30.0,316667,55.754983,37.525217
"Москва, пос. Московский, дер. Румянцево, д. 3, вл. 17Е",82.1,111393,55.633963,37.425468
"Москва, ул. Берзарина, 28Ак2",74.0,225676,55.790469,37.475342
"Москва, 1-й Красногвардейский пр., вл17-18",72.9,479868,55.751143,37.533733
"Москва, Шмитовский пр., 39Ас3",59.0,301695,55.755135,37.526986
"Москва, ул. Паршина, вл. 10",72.3,310427,55.78975,37.456468
"Москва, Ленинградское ш., 94к2",93.0,195699,55.855785,37.471704
"Москва, Волоколамское ш., 71к2",93.0,208602,55.821077,37.430462
"Москва, пос. Коммунарка, ул. Потаповская Роща, 24к1",48.0,138542,55.55114,37.508176
"Москва, Новокузьминская 1-я , 22 корпус 3",80.0,206250,55.711899,37.792959
"Москва, ул. Перерва, 39",76.0,204605,55.659195,37.746472
"Москва, Дмитровское ш., 107Ак2",34.0,194118,55.878889,37.538637
"Москва, ул. Производственная, вл. 6, стр. 8",75.9,145076,55.644821,37.391215
"Москва, ул. Краснобогатырская, д. 90, стр. 2",107.0,336449,55.800423,37.710063
"Москва, ул. Производственная, вл. 6, стр. 9",38.0,186202,55.647254,37.386418
"Москва, Россия, Москва, Водный стадион, Головинский, Пулковская улица, 3к1",34.9,211180,55.844223,37.481442
"Москва, ул. Производственная, вл. 6, стр. 7",64.0,190860,55.643632,37.393164
"Москва, Муравская ул., 38к2",54.0,190722,55.862681,37.37244
"Москва, Карамышевская наб, д.2а",84.0,200000,55.769135,37.494521
"Москва, Андреевская наб, д.1к1",83.0,442169,55.712954,37.577948
"Москва, ул. Вересаева, 9",57.0,877193,55.719318,37.445779
"Москва, Москва г, Шеногина ул, 6К6",74.0,243243,55.763984,37.507681
"Москва, ул. Юннатов, вл. 4",62.0,318000,55.798439,37.563718
"Москва, пр-т 40 лет Октября, 36",19.0,194737,55.673621,37.745466
"Москва, ул. Лобачевского, вл. 120",36.3,244555,55.696128,37.469773
"Москва, ул. Вертолетчиков, д. 4",36.0,143653,55.702637,37.94305
"Москва, ул. Золоторожский Вал, д. 3, корп. 1",28.0,283929,55.748858,37.683033
"Москва, г Москва, ул Ясеневая, 14 к6",54.4,197610,55.59898,37.731119
